"ID","Question","OptionA","OptionB","OptionC","OptionD","OptionE","CorrectAnswer","Explanation","ImageURL"
"27","A 47 year old woman, who had just finished her surgical fixation for a complex distal radial fracture of the right arm 12 hours ago, complains of severe forearm pain in the PACU. The anesthetist suspects that the increasing pain is caused by an incomplete nerve block and hence she performs another nerve block with ropivacaine. However, the patient was still screaming due to severe pain and hence the anesthetist came to you. Being Dr. Ooguway, the Master of Medicine, what would be the least appropriate next step in this case?","Check if there is any tingling or pin prick sensation over the area","Check for pale skin tone over the area","Use a needle manometer","Passively extend the muscles and see whether there is increase in pain","Check for any weakness in movement of fingers","C","This is commonly used for unconscious/obtunded patients in clinical practice because you cant elicit pain history from them. However, if the patient complains of excruciating pain and if in the right clinical context, emergency management for compartment syndrome can be performed. Check for 5 Ps if suspect compartment syndrome  Pain, Paresthesia, pressure, pallor, pulselessness.",""
"39","Which nerve is most commonly injured in humeral shaft fractures?","Median nerve","Ulnar nerve","Radial nerve","Axillary nerve","Musculocutaneous nerve","C","The radial nerve is most commonly injured in humeral shaft fractures due to its intimate relationship with the spiral groove (radial groove) on the posterior aspect of the mid-shaft humerus.","https://example.com/humeral_shaft_fracture.jpg"
"12","A 40-year-old man develops progressive back pain, saddle anesthesia, and urinary retention 24 hours after lifting a heavy object. Exam shows decreased anal tone and bilateral S1 weakness. Best immediate management?","Urgent lumbar MRI and emergent decompression within hours","Trial of oral steroids and outpatient MRI","Bed rest with NSAIDs and re-evaluation in 72 hours","Electrodiagnostic studies prior to imaging","CT lumbar spine without contrast only","A","This presentation is classic for cauda equina syndrome with red flags (saddle anesthesia, urinary retention, bilateral deficits). Requires urgent MRI for diagnosis and emergent surgical decompression ideally within hours to improve neurological and bladder outcomes. Delays worsen prognosis. Conservative care, CT alone, or electrodiagnostics are inappropriate in this emergency.",""
"30","The 'unhappy triad' of the knee consists of tears to which three structures?","ACL","MCL","medial meniscus","ACL","PCL","LCL","PCL","MCL"
"3","A 63 year old Venezuelan male undergoes a C4-7 posterior fusion and laminectomy secondary to spinal cord stenosis. Pre-operative examination reveals neck pain and finger clumsiness. On post-op day 1, the gentleman complains of significant weakness raising his left arm overhead, and on examination you note a clear sensation deficit over the lateral shoulder. What structure is most commonly affected in this procedure?","C4 nerve root","Suprascapular nerve","Axillary nerve","C5 nerve root","C6 nerve root","D","",""
"63",". Which of the following would you want to consider in acute management of this patient?","4","2 and 4","2","3 and 4","1","2","3 and 4",""
"17","A 47 year old woman","who had just finished her surgical fixation for a complex distal radial fracture of the right arm 12 hours ago","complains of severe forearm pain in the PACU. The anesthetist suspects that the increasing pain is caused by an incomplete nerve block and hence she performs another nerve block with ropivacaine. However","the patient was still screaming due to severe pain and hence the anesthetist came to you. what would be the least appropriate next step in this case?","Check if there is any tingling or pin prick sensation over the area","Check for pale skin tone over the area","Use a needle manometer","Passively extend the muscles and see whether there is increase in pain",""
"65","A 62-year-old diabetic presents with acute atraumatic hot, swollen knee and severe pain. Temperature 38.6 C. WBC 14 x10^9/L, CRP elevated. Best next step?","Urgent knee MRI with contrast","Start oral antibiotics and review in 48 hours","Urgent joint aspiration for cell count, Gram stain, and culture","Intra-articular steroid injection","Order uric acid level and treat as gout","C","Septic arthritis is an orthopedic emergency. Urgent joint aspiration for synovial WBC, Gram stain, and culture guides immediate IV antibiotics and surgical washout as indicated. Delaying aspiration risks joint destruction. Steroids are contraindicated in suspected infection. Imaging and uric acid testing should not delay aspiration.",""
"61","The 'drop arm test' is used to assess:","Biceps tendon rupture","Supraspinatus tear","Subscapularis tear","Infraspinatus tear","Teres minor tear","B","The drop arm test specifically evaluates supraspinatus function. A positive test (inability to slowly lower the arm from 90° abduction) suggests a significant supraspinatus tear.","https://example.com/drop_arm_test.jpg"
"46","A 20 year old patient presents to the ED unconscious following a car accident. What would be your next appropriate management?","AP view X- ray","Odontoid view x-ray","Apply C-spine collar","Intubation","Try moving the neck to test ROM of neck","C","Always suspect C-spine injuries in patients who present after fall from height, diving accident or vehicle accident in which neck is forcibly moved. Furthermore, look out for the following signs and symptoms of cervical spine fracture / spinal cord injury (Unconscious from head injury, abnormal position of neck, tenderness on palpation or pain/ parasthesia in limbs). Secure C-spine before ABCs to prevent any unwanted trauma. In such high risk patients, only remove C-collar after confirming through imaging.",""
"60","What is the most common type of shoulder dislocation?","Anterior","Posterior","Inferior","Superior","Luxatio erecta","A","Anterior shoulder dislocations account for over 95% of all shoulder dislocations.","https://example.com/shoulder_dislocation.jpg"
"55","A 16-year-old overweight boy presents with 3 months of groin pain and limp. Exam shows obligate external rotation with hip flexion. AP and frog-leg lateral pelvis show posterior-inferior displacement of the femoral head relative to the neck. Most likely diagnosis?","Legg-Calvé-Perthes disease","Slipped capital femoral epiphysis","Developmental dysplasia of the hip","Femoroacetabular impingement","Transient synovitis","B","SCFE typically affects overweight adolescents with hip or knee pain, limp, and obligate external rotation with flexion. Radiographs show posterior-inferior slip on frog-leg view. Perthes affects younger children with AVN. DDH is a pediatric instability condition. FAI presents in young adults with activity-related groin pain without epiphyseal slip. Transient synovitis is acute and self-limiting.",""
"25","When compared with primary arthrodesis for the treatment of ligamentous Lisfranc injuries, ORIF has which of the following?","Higher overall cost of treatment","Higher rate of deep infection","Improved patient reported outcomes","Lower implant removal rates","Lower revision surgery rate","A","Lisfranc injury is a TMT #-dislocation with traumatic disruption between the articulation of the medial cuneiform and base of the 2nd metatarsal. ORIF is indicated if (1) evidence of instability (>2mm shift); and (2) bony #-dislocations. PA is indicated for (1) purely ligamentous injury, (2) delayed treatment or (3) chronic deformity.",""
"35","Which imaging modality is best for diagnosing rotator cuff tears?","X-ray","CT scan","MRI","Ultrasound","Arthrogram","C","MRI is the gold standard for diagnosing rotator cuff tears","providing excellent soft tissue contrast and ability to assess tear size"
"49","Mr Chua, a 50 year old Chinese male, presents with reduced active and passive range of motion of his right shoulder, and is diagnosed with adhesive capsulitis. Which of the following is a known risk factor for the development of adhesive capsulitis?","Menopause","Steroid use","Diabetes mellitus","Renal disease","All of the above","C","",""
"20","Which one of the following is false about the clinical examinations of an ACL tear?","Posterior drawer is negative","Anterior drawer is positive","There is posterior sag of the knee","Lachman test is positive","Pivot shift is positive","C","Posterior sag and drawer are positive for PCL tear.",""
"6",". The external fixation was done and the surgery went well. The pateints trachea was extubated and he was then transported to the Postanesthesia Care Unit (PACU). However","during the first hour","his oxygen saturation dropped to 85-90% and hence he is delivered oxygen at 2 litres/min via nasal cannula. However","the saturation does not improve","and the patient seems to develop respiratory distress and appears to be in a confused state. On closer inspection","petechial rash was seen over the patient�s chest and he had subconjunctival hemorrhage too.","Pulmonary embolism","Sepsis","Fat embolism"
"40","Which nerve is at risk during surgery for carpal tunnel syndrome?","Radial nerve","Ulnar nerve","Median nerve","Axillary nerve","Musculocutaneous nerve","C","Carpal tunnel syndrome involves compression of the median nerve","and it is the nerve at risk during surgical decompression."
"48","A 22-year-old gymnast has ulnar-sided wrist pain and paresthesia in the ring and little fingers worse with cycling. Tinel is positive at the wrist, and symptoms worsen with wrist extension and pressure over the pisohamate tunnel. Most likely site of nerve compression?","Carpal tunnel beneath the flexor retinaculum","Arcade of Frohse in the proximal forearm","Cubital tunnel at the elbow","Guyon’s canal at the wrist","Pronator teres muscle heads","D","Ulnar nerve compression at Guyon’s canal presents with ulnar-sided wrist pain and paresthesia of the ulnar digits, often aggravated by cycling due to handlebar pressure over the canal. Carpal tunnel affects the median nerve. Arcade of Frohse and pronator teres involve radial and median nerves respectively. Cubital tunnel is at the elbow, not wrist.",""
"32","After 6 months, you reassess the patient's fracture and you find that the patient experiences non-union since the healing of the bones has ceased. Which is not a common site of non-union?","Distal tibia","Scaphoid","Neck of femur","Lateral humeral condyle","Midshaft femur","E","Distal tibia has a poor muscle coverage while scaphoid bone and neck of femur have poor blood supplies esp if the fracture occurs in a specific area which causes avascular necrosis.",""
"50","An asymptomatic 65-year-old woman with hypertension and a history of gastroesophageal reflux–related esophageal stricture is found on routine screening to have a T-score of –2.6 SD. She experienced menarche at age 11, menopause 8 years ago, and was treated for endometrial hyperplasia 20 years ago; her last mammogram and Pap smear 6 months ago were normal. She has no children, a maternal history of breast cancer, and currently takes lansoprazole and hydrochlorothiazide. The physician recommends raloxifene for osteoporosis prophylaxis and asks about its specific adverse effects.","Mandibular osteonecrosis","Endometrial cancer","Osteosarcoma","Hypercholesterolemia","Deep venous thrombosis","E","Raloxifene is a selective estrogen receptor modulator that acts as an estrogen agonist in bone and antagonist in breast and endometrium, reducing bone resorption without increasing endometrial cancer risk. However, it mimics estrogen's prothrombotic effects, significantly increasing the risk of venous thromboembolism such as deep venous thrombosis. It does not cause mandibular osteonecrosis or osteosarcoma, and it does not adversely affect lipid profiles to cause hypercholesterolemia. Patient counseling should emphasize VTE risk when starting raloxifene.",""
"56","Which bone is most commonly fractured in the wrist?","Radius","Ulna","Scaphoid","Lunate","Triquetrum","C","The scaphoid is the most commonly fractured carpal bone","typically occurring after a fall on an outstretched hand (FOOSH injury) with the wrist extended and radially deviated."
"64","Which one of the following is not commonly used as a graft for ACL reconstruction?","Semitendinosis","Gracilis","Patella tendon","Biceps femoris","A","","",""
"31","What is the most common mechanism of anterior cruciate ligament (ACL) injury?","Contact injury with valgus stress","Non-contact pivoting injury","Hyperextension injury","Direct blow to the knee","Posterior drawer force","B","Most ACL injuries (70-80%) occur through non-contact mechanisms","typically during pivoting"
"52",". How would you manage this fracture?","Immediate wound closure and casting","External fixation and then close the wound after 48 hours","Intramedullary nail fixation and then close the wound within 24 hours","Intramedullary nail fixation and then close the wound after 48 hours","Intramedullary nail fixation and immediate wound closure","B","Casting is only used for very stable grade 1 and 2 open fractures which have minimal soft tissue damage.",""
"18",". What factors would you not consider when deciding which muscle is devitalized during debridement?","Color","Consistency","Compressibility","Capacity to bleed","Contractility","C","Excise all devitalized tissue. Muscle provides an excellent environment for bacteria to flourish. Thus","extensive debridement of contaminated and devascularized tissue should be completed. Attention to the classic �C�s� of muscle viability can assist the decision for excision: color"
"67","A 35-year-old man presents after a high-speed motor vehicle accident with severe neck pain and tingling in both hands. On examination, he has decreased strength in his upper limbs and brisk reflexes. Cervical spine X-ray shows anterior displacement of C5 over C6. What is the most likely diagnosis?","Central cord syndrome","Anterior cord syndrome","Brown-Sequard syndrome","Cervical spondylosis","Bilateral facet dislocation","E","Bilateral facet dislocation is suggested by anterior displacement of one vertebra over another following trauma, and presents with neurological deficits. Central cord syndrome typically presents with greater weakness in the upper limbs than lower limbs, but is not associated with vertebral displacement. Anterior cord syndrome and Brown-Sequard syndrome have different neurological findings. Cervical spondylosis is a degenerative condition, not traumatic.",""
"68","A 60-year-old woman presents with progressive lower back pain, bilateral leg weakness, and urinary retention. On examination, she has saddle anesthesia and decreased anal sphincter tone. What is the most appropriate next step?","Urgent MRI of the lumbar spine","Oral corticosteroids","Physical therapy referral","Electromyography","Lumbar X-ray","A","This is a classic presentation of cauda equina syndrome, a surgical emergency. The most appropriate next step is urgent MRI to confirm the diagnosis and plan decompression. Steroids and physical therapy are not first-line. Electromyography and X-ray are not diagnostic for cauda equina syndrome.",""
"69","Which of the following is considered a red flag symptom in patients presenting with back pain?","Morning stiffness lasting less than 30 minutes","Pain relieved by rest","History of trauma","Pain worsened by activity","Nocturnal pain and weight loss","E","Nocturnal pain and weight loss are red flag symptoms suggestive of malignancy or infection. History of trauma is also a red flag, but nocturnal pain and weight loss are more concerning for serious underlying pathology. Morning stiffness and pain relieved by rest are features of mechanical back pain.",""
"70","A 14-year-old girl is noted to have a right thoracic curve on school screening. The Cobb angle is measured at 28 degrees. What is the most appropriate management?","Observation only","Physical therapy","Bracing","Surgical correction","NSAIDs","C","Bracing is indicated for adolescent idiopathic scoliosis with Cobb angle between 25 and 40 degrees in skeletally immature patients. Observation is for curves less than 25 degrees, and surgery is considered for curves greater than 40-50 degrees. Physical therapy and NSAIDs do not alter curve progression.",""
"71","Which of the following is the most common cause of lumbar spinal stenosis in adults?","Congenital narrowing","Disc herniation","Ligamentum flavum hypertrophy","Spondylolisthesis","Facet joint osteoarthritis","E","Facet joint osteoarthritis is the most common cause of lumbar spinal stenosis in adults due to degenerative changes leading to narrowing of the spinal canal. Ligamentum flavum hypertrophy and disc herniation also contribute, but facet joint degeneration is most common.",""
"72","A 45-year-old man presents with sudden onset severe back pain and inability to move his legs after lifting a heavy object. He has loss of pain and temperature sensation below the level of the lesion, but preserved vibration and proprioception. What spinal cord syndrome does he have?","Central cord syndrome","Anterior cord syndrome","Brown-Sequard syndrome","Posterior cord syndrome","Conus medullaris syndrome","B","Anterior cord syndrome results in loss of pain and temperature sensation with preserved vibration and proprioception, due to involvement of the anterior two-thirds of the cord. Central cord syndrome affects upper limbs more than lower. Brown-Sequard is hemisection. Posterior cord syndrome affects vibration/proprioception. Conus medullaris presents with bladder/bowel symptoms.",""
"73","Which of the following is the most sensitive imaging modality for detecting spinal epidural abscess?","Plain X-ray","CT scan","MRI with contrast","Ultrasound","Bone scan","C","MRI with contrast is the most sensitive imaging modality for detecting spinal epidural abscess, allowing visualization of soft tissue and abscess formation. CT and X-ray are less sensitive. Ultrasound is not useful for spine imaging. Bone scan may show increased uptake but is not specific.",""
"74","A 55-year-old man with a history of prostate cancer presents with new onset back pain and lower limb weakness. What is the most likely cause?","Degenerative disc disease","Spinal epidural abscess","Vertebral compression fracture","Metastatic spinal cord compression","Lumbar spondylosis","D","In a patient with a history of cancer, new back pain and neurological deficits suggest metastatic spinal cord compression. Degenerative disc disease and spondylosis are less likely to cause acute neurological symptoms. Epidural abscess is possible but less likely without infection risk factors.",""
"75","Which of the following is NOT a typical feature of ankylosing spondylitis?","Bamboo spine on X-ray","HLA-B27 positivity","Morning stiffness","Osteophyte formation","Reduced chest expansion","D","Osteophyte formation is not typical of ankylosing spondylitis; it is more characteristic of osteoarthritis. Bamboo spine, HLA-B27 positivity, morning stiffness, and reduced chest expansion are classic features of ankylosing spondylitis.",""
"76","A 32-year-old man presents with progressive weakness and numbness of his right leg after being stabbed in the back. On examination, he has loss of pain and temperature sensation on the left side and loss of motor function on the right below the lesion. What syndrome does he have?","Anterior cord syndrome","Central cord syndrome","Brown-Sequard syndrome","Posterior cord syndrome","Cauda equina syndrome","C","Brown-Sequard syndrome is caused by hemisection of the spinal cord, often due to penetrating trauma. It results in ipsilateral motor loss and contralateral pain and temperature loss. Anterior cord syndrome affects both sides. Central cord syndrome affects upper limbs more. Posterior cord syndrome affects proprioception.",""
"32","A 35-year-old man presents with severe lower back pain radiating to his left leg, numbness in the perineal area, and new onset urinary retention. On examination, he has decreased anal tone and loss of sensation in the saddle area. What is the most appropriate next step in management?","Start high-dose corticosteroids","Order lumbar spine MRI and arrange urgent surgical decompression","Begin physical therapy","Prescribe oral analgesics","B","This patient has classic signs of cauda equina syndrome (saddle anesthesia, urinary retention, decreased anal tone). The most appropriate next step is urgent MRI to confirm the diagnosis and immediate surgical decompression to prevent permanent neurological deficits. Steroids and physical therapy are not first-line. Analgesics alone are insufficient and delay definitive care.",""
"33","A 70-year-old woman with osteoporosis presents after a minor fall with sudden onset mid-back pain. X-ray reveals a wedge-shaped compression fracture of T12. What is the most likely underlying mechanism for this fracture?","High-energy trauma","Flexion-compression injury","Extension injury","Rotational injury","B","Osteoporotic vertebral compression fractures typically occur due to a flexion-compression mechanism, especially in the thoracolumbar junction. High-energy trauma is less common in elderly osteoporotic patients. Extension and rotational injuries are rare causes of compression fractures.",""
"34","Which of the following is considered a red flag symptom in a patient presenting with low back pain?","Pain worsened by movement and relieved by rest","Morning stiffness lasting less than 30 minutes","Progressive lower limb weakness and urinary incontinence","History of mild trauma","C","Progressive neurological deficits (such as lower limb weakness and urinary incontinence) are red flag symptoms that may indicate serious spinal pathology like cauda equina syndrome or spinal cord compression. The other options are not considered red flags.",""
"35","A 45-year-old man presents with neck pain after a motor vehicle accident. He is alert, has no neurological deficits, and no midline cervical tenderness. According to the Canadian C-spine rule, what is the next best step?","Obtain cervical spine X-rays","Perform a CT scan of the cervical spine","Clear the cervical spine clinically without imaging","Admit for observation","C","The Canadian C-spine rule allows clinical clearance of the cervical spine in alert patients with no neurological deficits and no midline tenderness, provided there are no high-risk features. Imaging is not required in this scenario.",""
"36","A 60-year-old man with metastatic prostate cancer develops acute onset back pain and rapidly progressive bilateral lower limb weakness. What is the most likely diagnosis?","Lumbar disc herniation","Spinal epidural abscess","Metastatic spinal cord compression","Cauda equina syndrome","C","Metastatic spinal cord compression is common in patients with known malignancy and presents with acute back pain and neurological deficits. Prompt diagnosis and treatment are essential to prevent permanent paralysis. Disc herniation and abscess are less likely given the history.",""
"37","Which of the following is the most common complication following lumbar discectomy surgery?","Wound infection","Recurrent disc herniation","Dural tear","Nerve root injury","B","Recurrent disc herniation is the most common complication after lumbar discectomy, occurring in up to 10-15% of cases. Wound infection, dural tear, and nerve root injury are recognized complications but are less frequent.",""
"38","A 16-year-old adolescent presents with a painless rib hump noticed during a school screening. X-ray shows a right thoracic curve with a Cobb angle of 35 degrees. What is the most appropriate initial management?","Observation only","Bracing","Surgical correction","Physical therapy","B","For adolescent idiopathic scoliosis with a Cobb angle between 25 and 40 degrees and skeletal immaturity, bracing is indicated to prevent progression. Observation is for milder curves, and surgery is reserved for severe or progressive curves.",""
"39","Which of the following is the most sensitive imaging modality for detecting early spinal epidural abscess?","Plain radiography","CT scan","MRI with contrast","Bone scan","C","MRI with contrast is the most sensitive and specific imaging modality for early detection of spinal epidural abscess. CT and X-ray are less sensitive, and bone scan is not specific.",""
"40","A 50-year-old man presents with chronic low back pain and stiffness that improves with exercise but not with rest. He has limited lumbar flexion and reduced chest expansion. Which of the following is the most likely diagnosis?","Degenerative disc disease","Ankylosing spondylitis","Lumbar strain","Spinal stenosis","B","Ankylosing spondylitis presents with inflammatory back pain, morning stiffness that improves with activity, and reduced spinal mobility. Degenerative disease and strain do not typically improve with exercise.",""
